date,text
2026-03-13 18:16:42,"Соллерс готовится запустить новое производство рулевых колес, подушек и ремней безопасности, а также электронных блоков управления на индустриальной площадке УАЗ #SVAV"
2026-03-13 17:55:47,Эксперт РА перешло на ПО для управления динамической ИТ-инфраструктурой от Базиса #BAZA
2026-03-13 17:38:14,Наши санкции в отношении России по нефти вполне оправданы и мы не собираемся их отменять — пресс-секретарь Еврокомиссии Шивон Макгарри #SNGS
2026-03-13 17:26:29,МНЕНИЕ: Ренессанс Капитал начинает аналитическое покрытие ДОМ.РФ с целевой ценой 2 700 руб. на горизонте 12 месяцев и рейтингом ПОКУПАТЬ #DOMRF
2026-03-13 17:17:17,"Экспорт нефтепродуктов из России морским путем в феврале 2026 года сократился на 3,3% г/г до 7,97 млн т — Reuters #ROSN #LKOH #NMTP"
